{
  "week_start": "2026-02-23",
  "timezone": "America/Los_Angeles",
  "training_focus": "Base endurance + strength (alt)",
  "schedule": [
    {"date": "2026-02-23", "day_type": "high", "notes": "Intervals"},
    {"date": "2026-02-24", "day_type": "high", "notes": "Tempo"},
    {"date": "2026-02-25", "day_type": "training", "notes": "Easy run"},
    {"date": "2026-02-26", "day_type": "rest", "notes": "Mobility only"},
    {"date": "2026-02-27", "day_type": "training", "notes": "Strength"},
    {"date": "2026-02-28", "day_type": "high", "notes": "Long run"},
    {"date": "2026-03-01", "day_type": "rest", "notes": "Rest"}
  ]
}
